[
  {
    "id": "bhuvan-land-1",
    "title": "Land Use / Land Cover (1:250k)",
    "description": "National land use / land cover map at 1:250,000 from multi-temporal satellite data.",
    "portal": "bhuvan",
    "theme": "land",
    "coverage": "All India",
    "state": null,
    "formats": [
      "GeoTIFF",
      "Shapefile",
      "WMS"
    ],
    "access_tier": "Open",
    "licence": "Open licence",
    "url": "https://bhuvan.nrsc.gov.in",
    "source_class": "eo-derived",
    "downloadable": true,
    "api": false,
    "ogc": true,
    "machine_readable": true,
    "gis_ready": true,
    "api_ready": false,
    "published_year": "2022",
    "updated_year": "2023",
    "keywords": [
      "LULC",
      "land use",
      "land cover"
    ],
    "link_health": "live",
    "verified_at": "2026-08-20T05:13:15Z"
  },
  {
    "id": "bhuvan-land-2",
    "title": "Wasteland Atlas (3rd cycle)",
    "description": "National wasteland mapping and atlas derived from satellite imagery.",
    "portal": "bhuvan",
    "theme": "land",
    "coverage": "All India",
    "state": null,
    "formats": [
      "Shapefile",
      "GeoTIFF",
      "WMS"
    ],
    "access_tier": "Open",
    "licence": "Open licence",
    "url": "https://bhuvan.nrsc.gov.in",
    "source_class": "eo-derived",
    "downloadable": true,
    "api": false,
    "ogc": true,
    "machine_readable": true,
    "gis_ready": true,
    "api_ready": false,
    "published_year": "2019",
    "updated_year": null,
    "keywords": [
      "wasteland",
      "degraded land"
    ],
    "link_health": "live",
    "verified_at": "2026-08-20T05:13:15Z"
  },
  {
    "id": "bhuvan-urban-3",
    "title": "National Urban/Peri-urban LULC",
    "description": "Urban land use / land cover mapping for major Indian cities.",
    "portal": "bhuvan",
    "theme": "urban",
    "coverage": "All India",
    "state": null,
    "formats": [
      "GeoTIFF",
      "WMS"
    ],
    "access_tier": "Open",
    "licence": "Open licence",
    "url": "https://bhuvan.nrsc.gov.in",
    "source_class": "eo-derived",
    "downloadable": true,
    "api": false,
    "ogc": true,
    "machine_readable": true,
    "gis_ready": true,
    "api_ready": false,
    "published_year": null,
    "updated_year": null,
    "keywords": [
      "urban",
      "cities"
    ],
    "link_health": "live",
    "verified_at": "2026-08-20T05:13:15Z"
  },
  {
    "id": "bhuvan-imagery-4",
    "title": "Bhuvan Cartosat Ortho Imagery",
    "description": "High-resolution Cartosat orthorectified imagery mosaics for India.",
    "portal": "bhuvan",
    "theme": "imagery",
    "coverage": "All India",
    "state": null,
    "formats": [
      "WMS",
      "GeoTIFF"
    ],
    "access_tier": "Open (Registration)",
    "licence": "Restricted",
    "url": "https://bhuvan.nrsc.gov.in/",
    "source_class": "eo-derived",
    "downloadable": false,
    "api": true,
    "ogc": true,
    "machine_readable": true,
    "gis_ready": true,
    "api_ready": true,
    "published_year": null,
    "updated_year": null,
    "keywords": [
      "cartosat",
      "ortho",
      "imagery"
    ],
    "link_health": "live",
    "verified_at": "2026-08-20T05:13:15Z"
  },
  {
    "id": "bhuvan-agriculture-5",
    "title": "Soil Resource Mapping",
    "description": "District-wise soil resource maps and land capability classification.",
    "portal": "bhuvan",
    "theme": "agriculture",
    "coverage": "All India",
    "state": null,
    "formats": [
      "Shapefile",
      "PDF"
    ],
    "access_tier": "Open",
    "licence": "Open licence",
    "url": "https://bhuvan.nrsc.gov.in",
    "source_class": "eo-derived",
    "downloadable": true,
    "api": false,
    "ogc": false,
    "machine_readable": true,
    "gis_ready": true,
    "api_ready": false,
    "published_year": null,
    "updated_year": null,
    "keywords": [
      "soil",
      "agriculture"
    ],
    "link_health": "live",
    "verified_at": "2026-08-20T05:13:15Z"
  },
  {
    "id": "bhuvan-water-6",
    "title": "Ground Water Prospects Map",
    "description": "Hydro-geomorphological groundwater prospect zones from satellite data.",
    "portal": "bhuvan",
    "theme": "water",
    "coverage": "All India",
    "state": null,
    "formats": [
      "GeoTIFF",
      "Shapefile",
      "WMS"
    ],
    "access_tier": "Open",
    "licence": "Open licence",
    "url": "https://bhuvan.nrsc.gov.in",
    "source_class": "eo-derived",
    "downloadable": true,
    "api": false,
    "ogc": true,
    "machine_readable": true,
    "gis_ready": true,
    "api_ready": false,
    "published_year": null,
    "updated_year": null,
    "keywords": [
      "groundwater",
      "hydrogeology"
    ],
    "link_health": "live",
    "verified_at": "2026-08-20T05:13:15Z"
  },
  {
    "id": "bhoonidhi-imagery-7",
    "title": "Resourcesat-2 LISS-III/LISS-IV Scenes",
    "description": "Multi-spectral Resourcesat imagery for download after registration.",
    "portal": "bhoonidhi",
    "theme": "imagery",
    "coverage": "All India",
    "state": null,
    "formats": [
      "GeoTIFF"
    ],
    "access_tier": "Open (Registration)",
    "licence": "Restricted",
    "url": "https://bhoonidhi.nrsc.gov.in",
    "source_class": "eo-derived",
    "downloadable": false,
    "api": true,
    "ogc": false,
    "machine_readable": true,
    "gis_ready": true,
    "api_ready": false,
    "published_year": null,
    "updated_year": null,
    "keywords": [
      "resourcesat",
      "LISS",
      "multispectral"
    ],
    "link_health": "live",
    "verified_at": "2026-08-20T05:13:15Z"
  },
  {
    "id": "bhoonidhi-imagery-8",
    "title": "Cartosat-2/3 High-Resolution Scenes",
    "description": "Very-high-resolution Cartosat panchromatic and multispectral scenes.",
    "portal": "bhoonidhi",
    "theme": "imagery",
    "coverage": "All India",
    "state": null,
    "formats": [
      "GeoTIFF"
    ],
    "access_tier": "Restricted",
    "licence": "Restricted",
    "url": "https://bhoonidhi.nrsc.gov.in",
    "source_class": "eo-derived",
    "downloadable": false,
    "api": true,
    "ogc": false,
    "machine_readable": true,
    "gis_ready": true,
    "api_ready": false,
    "published_year": null,
    "updated_year": null,
    "keywords": [
      "cartosat",
      "VHR"
    ],
    "link_health": "live",
    "verified_at": "2026-08-20T05:13:15Z"
  },
  {
    "id": "nices-forestry-9",
    "title": "Fractional Vegetation Cover (FVC)",
    "description": "Long-term fractional vegetation cover time series over India.",
    "portal": "nices",
    "theme": "forestry",
    "coverage": "All India",
    "state": null,
    "formats": [
      "GeoTIFF",
      "NetCDF"
    ],
    "access_tier": "Open",
    "licence": "Open licence",
    "url": "https://nices.nrsc.gov.in",
    "source_class": "eo-derived",
    "downloadable": true,
    "api": false,
    "ogc": true,
    "machine_readable": true,
    "gis_ready": true,
    "api_ready": false,
    "published_year": "2020",
    "updated_year": "2023",
    "keywords": [
      "vegetation",
      "NDVI"
    ],
    "link_health": "live",
    "verified_at": "2026-08-20T05:13:15Z"
  },
  {
    "id": "nices-climate-10",
    "title": "Land Surface Temperature",
    "description": "Long-term land surface temperature climatology and anomalies.",
    "portal": "nices",
    "theme": "climate",
    "coverage": "All India",
    "state": null,
    "formats": [
      "GeoTIFF",
      "NetCDF"
    ],
    "access_tier": "Open",
    "licence": "Open licence",
    "url": "https://nices.nrsc.gov.in",
    "source_class": "eo-derived",
    "downloadable": true,
    "api": false,
    "ogc": false,
    "machine_readable": true,
    "gis_ready": true,
    "api_ready": false,
    "published_year": "2020",
    "updated_year": "2023",
    "keywords": [
      "LST",
      "temperature"
    ],
    "link_health": "live",
    "verified_at": "2026-08-20T05:13:15Z"
  },
  {
    "id": "nices-water-11",
    "title": "Evapotranspiration (ET)",
    "description": "Actual evapotranspiration derived from satellite energy balance.",
    "portal": "nices",
    "theme": "water",
    "coverage": "All India",
    "state": null,
    "formats": [
      "GeoTIFF",
      "NetCDF"
    ],
    "access_tier": "Open",
    "licence": "Open licence",
    "url": "https://nices.nrsc.gov.in",
    "source_class": "eo-derived",
    "downloadable": true,
    "api": false,
    "ogc": false,
    "machine_readable": true,
    "gis_ready": true,
    "api_ready": false,
    "published_year": null,
    "updated_year": null,
    "keywords": [
      "evapotranspiration",
      "ET"
    ],
    "link_health": "live",
    "verified_at": "2026-08-20T05:13:15Z"
  },
  {
    "id": "mosdac-climate-12",
    "title": "INSAT-3D Weather Imagery",
    "description": "Geostationary INSAT-3D/3DR satellite imagery and derived products.",
    "portal": "mosdac",
    "theme": "climate",
    "coverage": "All India",
    "state": null,
    "formats": [
      "GeoTIFF",
      "NetCDF",
      "HDF"
    ],
    "access_tier": "Open (Registration)",
    "licence": "Open licence",
    "url": "https://www.mosdac.gov.in",
    "source_class": "eo-derived",
    "downloadable": true,
    "api": true,
    "ogc": false,
    "machine_readable": true,
    "gis_ready": true,
    "api_ready": true,
    "published_year": null,
    "updated_year": null,
    "keywords": [
      "INSAT",
      "weather",
      "satellite"
    ],
    "link_health": "live",
    "verified_at": "2026-08-20T05:13:15Z"
  },
  {
    "id": "mosdac-climate-13",
    "title": "Rainfall Estimates (IMD-MOSDAC)",
    "description": "Gridded rainfall estimates from satellite and gauge blending.",
    "portal": "mosdac",
    "theme": "climate",
    "coverage": "All India",
    "state": null,
    "formats": [
      "NetCDF",
      "CSV"
    ],
    "access_tier": "Open (Registration)",
    "licence": "Open licence",
    "url": "https://www.mosdac.gov.in",
    "source_class": "eo-derived",